[
  {
    "platform": "amazon",
    "external_id": "B0DLQ8MVF7",
    "source_url": "https://www.amazon.com/dp/B0DLQ8MVF7",
    "title": "Custom Best Friend Dog, Cat, or Pet Photo T-Shirt for Men, Women and Kids - Customize with Your Pet's Name and Photo",
    "description": "Customize by uploading a photo or image of your dog, cat, or Pet. Personalize further by adding your pet's name name and birth year.\nCreate your own dog, cat, or pet photo t-shirt. Perfect for pet parents, kids, or a gift.\nClassic, casual tee with a ribbed crewneck, straight hem, durable-double needle stitching, and short sleeves for everyday comfort.\nAvailable in an inclusive range of sizes for the perfect fit, including fits for men, women, toddlers, kids, big and tall, and plus size. For classic styling in all-gender, unisex sizes, consider the Men's fit type.\nPrinted in the USA using Direct-to-Garment (DTG) printing technology.",
    "author_id": null,
    "published_at": null,
    "cover_url": "https://m.media-amazon.com/images/I/B1pppR4gVKL._CLa%7C2140%2C2000%7C9161ur4TZEL.png%7C0%2C0%2C2140%2C2000%2B0.0%2C0.0%2C2140.0%2C2000.0_AC_SX342_SY445_QL70_FMwebp_.png",
    "media_urls": [
      "https://m.media-amazon.com/images/I/B1pppR4gVKL._CLa%7C2140%2C2000%7C9161ur4TZEL.png%7C0%2C0%2C2140%2C2000%2B0.0%2C0.0%2C2140.0%2C2000.0_AC_SX342_SY445_QL70_FMwebp_.png"
    ],
    "hashtags": [],
    "stats": {
      "views": null,
      "likes": null,
      "comments": null,
      "shares": null,
      "collections": null
    },
    "commerce": {
      "price": 14.99,
      "currency": "USD",
      "brand": "Modify by Amazon Merch on Demand",
      "rating": 4.6,
      "rating_count": 104,
      "written_review_count": null,
      "date_first_available_raw": "November 1, 2024",
      "best_sellers_rank_raw": "#729,415 in Clothing, Shoes & Jewelry ( See Top 100 in Clothing, Shoes & Jewelry ) #20,009 in Boys' Novelty T-Shirts #20,326 in Girls' Novelty T-Shirts #31,092 in Women's Novelty T-Shirts",
      "recent_purchase_text": null,
      "availability_text": "In Stock",
      "seller_name": null
    },
    "search": {
      "keyword": "custom pet portrait shirt",
      "selected_result_position": 1,
      "is_sponsored": null,
      "position_scope": "order_returned_by_amzpy_not_verified_page_rank"
    },
    "target_status_code": "partial",
    "fetched_at": "2026-10-08T10:20:04.796484+00:00",
    "evidence": {
      "description_source": "feature_bullets",
      "price_scope": "displayed_product_price_not_final_customized_order",
      "media_urls_complete": false,
      "price_source": "main_product_price_container",
      "price_raw": "$14.99",
      "delivery_location": "New York 10001‌",
      "currency_preference": "USD",
      "us_preferences_verified": true,
      "price_missing_reason": null,
      "rating_count_raw": "104 global ratings"
    }
  },
  {
    "platform": "amazon",
    "external_id": "B0GWVTMR4Q",
    "source_url": "https://www.amazon.com/dp/B0GWVTMR4Q",
    "title": "Custom Embroidered Dog Mom T-Shirt Portrait Outline Photo",
    "description": "Because Some Bonds Deserve to Be Worn, Not Just Felt – Upload a photo of your dog or cat, tell us their name, and we turn that love into something you can put on every morning. Their portrait is embroidered in outline on your chest and their name runs along your sleeve, so no matter where you go that day, you are carrying the one who always makes coming home the best part\nCrafted to Last as Long as the Love Behind It – Every portrait is stitched on Melco professional embroidery machines using Madeira thread, chosen for its rich color retention, smooth finish and ability to hold fine detail through years of daily wear. The raised stitching is woven directly into your t-shirt fabric, not printed on top of it, so it never cracks, never fades and never loses the sharpness that makes it look like your pet and no one else's\nFor the Birthday or Christmas When You Finally Get the Gift Right – You have seen someone tear up over a gift exactly once in your life, and it was not over something that came in standard packaging. A custom embroidered t-shirt with their own dog or cat on the chest and their pet's name on the sleeve is the kind of gift that makes someone hold it up, look at it quietly for a second, and then immediately want to put it on\nMade for the Person Whose Pet Is the First Thing They Talk About and the Last Thing They Think About – If you are someone who has rearranged your schedule for your dog, who refers to your cat in conversation as though everyone already knows them, and who would wear their face on a shirt to a dinner party without any apology, this t-shirt already belongs in your wardrobe. It was made with exactly you in mind\nSoft Enough to Become Your Favorite Shirt Without Trying – Your t-shirt is made from 100% cotton, naturally breathable, lightweight and gentle against your skin in a way that synthetic blends never quite manage. It starts soft and gets softer with every wash, slowly becoming the shirt that feels most like home, the one you pull out without thinking because everything else suddenly feels like the wrong choice",
    "author_id": "A358NHPDS1ZMEA",
    "published_at": null,
    "cover_url": "https://m.media-amazon.com/images/I/71FlRvKPwBL._AC_SX342_SY445_QL70_FMwebp_.jpg",
    "media_urls": [
      "https://m.media-amazon.com/images/I/71FlRvKPwBL._AC_SX342_SY445_QL70_FMwebp_.jpg"
    ],
    "hashtags": [],
    "stats": {
      "views": null,
      "likes": null,
      "comments": null,
      "shares": null,
      "collections": null
    },
    "commerce": {
      "price": 12.95,
      "currency": "USD",
      "brand": "EMBROLY",
      "rating": 5.0,
      "rating_count": 5,
      "written_review_count": null,
      "date_first_available_raw": "April 13, 2026",
      "best_sellers_rank_raw": "#56,481 in Handmade Products ( See Top 100 in Handmade Products ) #9,425 in Handmade Clothing & Accessories #419,725 in Women's Novelty T-Shirts #458,427 in Men's Novelty T-Shirts",
      "recent_purchase_text": null,
      "availability_text": "In stock Usually ships within 3 to 4 days.",
      "seller_name": "EmbrolyStore"
    },
    "search": {
      "keyword": "custom pet portrait shirt",
      "selected_result_position": 2,
      "is_sponsored": null,
      "position_scope": "order_returned_by_amzpy_not_verified_page_rank"
    },
    "target_status_code": "partial",
    "fetched_at": "2026-10-08T10:20:22.378657+00:00",
    "evidence": {
      "description_source": "feature_bullets",
      "price_scope": "displayed_product_price_not_final_customized_order",
      "media_urls_complete": false,
      "price_source": "main_product_price_container",
      "price_raw": "$12.95",
      "delivery_location": "New York 10001‌",
      "currency_preference": "USD",
      "us_preferences_verified": true,
      "price_missing_reason": null,
      "rating_count_raw": "5 global ratings"
    }
  },
  {
    "platform": "amazon",
    "external_id": "B0H22J6F1B",
    "source_url": "https://www.amazon.com/dp/B0H22J6F1B",
    "title": "Custom T Shirts Men Women Personalized Photo Text Logo Design Your Own Tee",
    "description": "CUSTOM T SHIRTS YOU DESIGN YOURSELF: Upload a photo, type a name, paste a company logo or write out a line that means something, and we print it across the front, the back or both sides in full colour. The customization window sits on this page above the buy button, so the layout is settled before the order goes through. There is no minimum order and no setup charge, which means one shirt costs the same per piece as a run of forty for a team, a family or an office. Artwork uploads in seconds.\nRING SPUN COTTON TEE, SMALL TO 4XL: The body is ring spun cotton with a set in crew neck, short sleeves and a regular unisex cut that runs true to the size chart on this page. Side seams are clean and the shoulders are taped so the shape holds after washing. Seven sizes cover Small through 4X-Large and the same cut is worn by men and women, so a team order does not need two separate style numbers. Check the chart before ordering rather than guessing. Machine wash cold and hang to dry.\nFRONT AND BACK PRINTING IN FULL COLOUR: The design is pressed into the fabric rather than laid on top as a patch, so the print moves with the shirt and does not crack across the chest after a wash cycle. Put one image on the front and a second on the back, or run a name list down the back of a whole group order. Turn the shirt inside out and wash it cold to keep the colour where it started. Line drying keeps the print sharpest. Bulk group orders ship in one box with a packing list inside.\nBIRTHDAYS, REUNIONS, WORK TEAMS AND CHRISTMAS: Print a family photograph for a reunion, a pet portrait for a partner, a class picture for a teacher at the end of term, or a logo run for a small business counter. Couples order matching pairs with a date printed on each. Offices order a set with every name on its own shirt. Bachelor and bachelorette parties order in bulk and pay the same per piece as a single order. Add a name so nobody mixes them up. Order early for Christmas and add a name.\nPRINTED IN THE USA AND CHECKED BY HAND: Every shirt is printed and packed in our own facility and held against your uploaded file under daylight lamps before it is folded and bagged. Send artwork at 300 dpi where you can and keep faces clear of the outer edge of the print area for the cleanest crop. If the print does not match the artwork you sent, or the shirt arrives damaged, please use Amazon Buyer-Seller Messaging and we will make it right. Tracking posts to your order. Colours stay true.",
    "author_id": "A21T9VMSLBQ6TP",
    "published_at": null,
    "cover_url": "https://m.media-amazon.com/images/I/711nSQfzk3L._AC_SX342_SY445_QL70_FMwebp_.jpg",
    "media_urls": [